{
  "$schema": "../schemas/side-stories.schema.json",
  "version": "2.0.0",
  "generatedAt": "2026-10-08T00:00:00.000Z",
  "description": "Authoritative Granblue Fantasy Side Stories Permanent Vault Catalog, indexing unlock prerequisites, free SSR/SR characters, Bahamut/Atma weapons, summons, draw ticket yields, and crystal totals.",
  "categories": [
    {
      "id": "anniversary",
      "name": "Anniversary & Core Lore",
      "japaneseName": "周年・主要",
      "description": "Epic anniversary story arcs introducing Lucilius, the Primarchs, the Eternals, and cosmic skyfarer lore. Rewards include Bahamut Nova weapon, Atma weapon, and core SSR characters.",
      "sideStoryCount": 6
    },
    {
      "id": "collaboration",
      "name": "Collaborations",
      "japaneseName": "コラボレーション",
      "description": "Permanent crossover collaborations featuring fully-voiced anime and gaming franchises with multiple free SSR frontline units and unique summons.",
      "sideStoryCount": 8
    },
    {
      "id": "dragon_knights",
      "name": "The Dragon Knights",
      "japaneseName": "四騎士・竜血族",
      "description": "The Feendrache saga tracking Lancelot, Vane, Percival, and Siegfried across court intrigue, civil unrest, and legendary knighthoods.",
      "sideStoryCount": 6
    },
    {
      "id": "society",
      "name": "The Society & The Foes",
      "japaneseName": "組織・星の敵",
      "description": "Sci-fi tactical operative thriller following Zeta, Vaseraga, Beatrix, Eustace, and Cassius combating the Moon Automata and the Foe.",
      "sideStoryCount": 7
    },
    {
      "id": "summer",
      "name": "Summer Festivities",
      "japaneseName": "サマー・バカンス",
      "description": "Auguste Island holiday adventures featuring beach crises, shark swarms, comedic situations, and summer character variants.",
      "sideStoryCount": 5
    },
    {
      "id": "sky_adventures",
      "name": "Sky Adventures & World Lore",
      "japaneseName": "空の冒険",
      "description": "Standalone character journeys, guild escapades, festival memories, and classic early-era Granblue Fantasy chronicles.",
      "sideStoryCount": 13
    },
    {
      "id": "robomi",
      "name": "Robomi Saga",
      "japaneseName": "ロボミ",
      "description": "Super robot tokusatsu sentai series pitting humanoid steel heroine Robomi and Professor Daimon against the Abominations.",
      "sideStoryCount": 3
    },
    {
      "id": "idols",
      "name": "Cinderella Fantasy",
      "japaneseName": "アイドルマスター シンデレラガールズ",
      "description": "Long-running Idolm@ster crossover chapters bringing 346 Production idols to the skies with custom element typings and voice tracks.",
      "sideStoryCount": 8
    }
  ],
  "globalTotals": {
    "totalSideStories": 56,
    "totalPremiumDrawTickets": 168,
    "totalStoryCrystals": 15650,
    "totalHalfElixirs": 5600,
    "totalSoulBerries": 28000,
    "totalFreeCharacters": 64,
    "totalSsrCharacters": 22
  },
  "sideStories": [
    {
      "id": "wmtsb_1",
      "sidestoryId": 1001,
      "title": "What Makes the Sky Blue",
      "japaneseTitle": "どうして空は蒼いのか",
      "category": "anniversary",
      "hashRoute": "#sidestory/top/1001",
      "unlockPrerequisite": {
        "mainQuestChapter": 54,
        "prerequisiteSideStories": []
      },
      "elements": {
        "bossElement": "dark",
        "advantageousElement": "light"
      },
      "rewards": {
        "premiumDrawTickets": 3,
        "storyCrystals": 350,
        "halfElixirsMax": 100,
        "soulBerriesMax": 500,
        "characters": [
          { "name": "Lyria", "japaneseName": "ルリア", "rarity": "SR", "element": "all", "joinCondition": "Story Chapter 1 Episode 4 Clear" }
        ],
        "weapons": [
          {
            "name": "Bahamut Weapon Nova (Choice of Dagger/Sword/Spear/Axe/Gun/Berdysh)",
            "rarity": "SSR",
            "type": "special",
            "element": "dark",
            "isBahamutOrAtma": true,
            "notes": "Arrives at Lv100 Skill 10 instantly. Single most pivotal power spike for early-to-midgame grids."
          },
          { "name": "Dominion Harp", "rarity": "SSR", "type": "harp", "element": "light" }
        ],
        "summons": [
          { "name": "Sandalphon (Summon)", "rarity": "SSR", "element": "light" }
        ]
      },
      "treasureTrade": {
        "medallionName": "Sky Blue Medallion",
        "secondaryTreasureName": "Angel Feather"
      },
      "priorityTier": 0
    },
    {
      "id": "wmtsb_2",
      "sidestoryId": 1002,
      "title": "What Makes the Sky Blue II: Paradise Lost",
      "japaneseTitle": "失楽園 どうして空は蒼いのか Part.II",
      "category": "anniversary",
      "hashRoute": "#sidestory/top/1002",
      "unlockPrerequisite": {
        "mainQuestChapter": 54,
        "prerequisiteSideStories": ["wmtsb_1"]
      },
      "elements": {
        "bossElement": "dark",
        "advantageousElement": "light"
      },
      "rewards": {
        "premiumDrawTickets": 3,
        "storyCrystals": 350,
        "halfElixirsMax": 100,
        "soulBerriesMax": 500,
        "characters": [
          { "name": "Sandalphon", "japaneseName": "サンダルフォン", "rarity": "SSR", "element": "light", "joinCondition": "Story Ending Clear" }
        ],
        "weapons": [
          {
            "name": "Atma Weapon (Choice of Sword/Staff/Dagger/Spear/Axe/Bow/Gun/Melee/Katana/Harp)",
            "rarity": "SSR",
            "type": "special",
            "element": "omni",
            "isBahamutOrAtma": true,
            "notes": "Arrives at Lv100 Skill 10. Foundational weapon for weapon proficiency party synergies."
          }
        ],
        "summons": [
          { "name": "Cradle of the Primarchs", "rarity": "SSR", "element": "light" }
        ]
      },
      "treasureTrade": {
        "medallionName": "Paradise Medallion",
        "secondaryTreasureName": "Silver Feather"
      },
      "priorityTier": 0
    },
    {
      "id": "wmtsb_3",
      "sidestoryId": 1003,
      "title": "What Makes the Sky Blue III: 000 (Triple Zero)",
      "japaneseTitle": "000 どうして空は蒼いのか Part.III",
      "category": "anniversary",
      "hashRoute": "#sidestory/top/1003",
      "unlockPrerequisite": {
        "mainQuestChapter": 54,
        "prerequisiteSideStories": ["wmtsb_2"]
      },
      "elements": {
        "bossElement": "dark",
        "advantageousElement": "light"
      },
      "rewards": {
        "premiumDrawTickets": 3,
        "storyCrystals": 350,
        "halfElixirsMax": 100,
        "soulBerriesMax": 500,
        "characters": [],
        "weapons": [
          { "name": "Innocent Love", "rarity": "SSR", "type": "harp", "element": "wind" }
        ],
        "summons": [
          { "name": "000 (Triple Zero)", "rarity": "SSR", "element": "light" }
        ]
      },
      "treasureTrade": {
        "medallionName": "Zero Medallion",
        "secondaryTreasureName": "Dark Feather"
      },
      "priorityTier": 0
    },
    {
      "id": "seeds_of_redemption",
      "sidestoryId": 1004,
      "title": "Seeds of Redemption",
      "japaneseTitle": "こくう、しんしん",
      "category": "anniversary",
      "hashRoute": "#sidestory/top/1004",
      "unlockPrerequisite": {
        "mainQuestChapter": 110,
        "prerequisiteSideStories": []
      },
      "elements": {
        "bossElement": "dark",
        "advantageousElement": "light"
      },
      "rewards": {
        "premiumDrawTickets": 3,
        "storyCrystals": 350,
        "halfElixirsMax": 100,
        "soulBerriesMax": 500,
        "characters": [
          { "name": "Seox (or Eternal Recruitment Trade Token)", "japaneseName": "シス", "rarity": "SSR", "element": "dark", "joinCondition": "Ending Clear Trade" }
        ],
        "weapons": [
          { "name": "Claw of the Cosmos", "rarity": "SSR", "type": "melee", "element": "dark" }
        ],
        "summons": []
      },
      "treasureTrade": {
        "medallionName": "Redemption Medallion",
        "secondaryTreasureName": "Sinister Mask"
      },
      "priorityTier": 0
    },
    {
      "id": "stay_moon",
      "sidestoryId": 1005,
      "title": "Stay Moon",
      "japaneseTitle": "STAY MOON",
      "category": "anniversary",
      "hashRoute": "#sidestory/top/1005",
      "unlockPrerequisite": {
        "mainQuestChapter": 130,
        "prerequisiteSideStories": ["spaghetti_syndrome", "home_sweet_home"]
      },
      "elements": {
        "bossElement": "dark",
        "advantageousElement": "light"
      },
      "rewards": {
        "premiumDrawTickets": 3,
        "storyCrystals": 350,
        "halfElixirsMax": 100,
        "soulBerriesMax": 500,
        "characters": [
          { "name": "Cassius (Event SSR)", "japaneseName": "カシウス", "rarity": "SSR", "element": "dark", "joinCondition": "Story Ending Clear" }
        ],
        "weapons": [
          { "name": "Machine Cell Relic Buster CCW", "rarity": "SSR", "type": "gun", "element": "omni" }
        ],
        "summons": []
      },
      "treasureTrade": {
        "medallionName": "Lunar Medallion",
        "secondaryTreasureName": "Moondust Fragment"
      },
      "priorityTier": 0
    },
    {
      "id": "and_you",
      "sidestoryId": 1006,
      "title": "...and you.",
      "japaneseTitle": "……アンド・ユー。",
      "category": "anniversary",
      "hashRoute": "#sidestory/top/1006",
      "unlockPrerequisite": {
        "mainQuestChapter": 132,
        "prerequisiteSideStories": []
      },
      "elements": {
        "bossElement": "dark",
        "advantageousElement": "light"
      },
      "rewards": {
        "premiumDrawTickets": 3,
        "storyCrystals": 350,
        "halfElixirsMax": 100,
        "soulBerriesMax": 500,
        "characters": [],
        "weapons": [
          { "name": "Paradox Hourglass", "rarity": "SSR", "type": "dagger", "element": "water" }
        ],
        "summons": [
          { "name": "Orologia", "rarity": "SSR", "element": "dark" }
        ]
      },
      "treasureTrade": {